{
  "$schema": "http://json-schema.org/draft-07/schema#",
  "type": "object",
  "title": "QuizConfig",
  "description": "A multi-question quiz with scoring",
  "required": ["title", "questions"],
  "properties": {
    "title": { "type": "string" },
    "questions": {
      "type": "array",
      "items": {
        "type": "object",
        "required": ["question", "options", "correct"],
        "properties": {
          "question": { "type": "string" },
          "options": { "type": "array", "items": { "type": "string" } },
          "correct": { "type": "number", "description": "0-indexed correct answer" },
          "explanation": { "type": "string" }
        }
      }
    },
    "showScore": { "type": "boolean" },
    "shuffleQuestions": { "type": "boolean" }
  }
}
