{
  "title": "General Knowledge Quiz",
  "questions": [
    {
      "question": "What planet is known as the Red Planet?",
      "options": ["Venus", "Mars", "Jupiter", "Saturn"],
      "correct": 1,
      "explanation": "Mars appears red due to iron oxide on its surface."
    },
    {
      "question": "What is the largest ocean on Earth?",
      "options": ["Atlantic", "Indian", "Pacific", "Arctic"],
      "correct": 2,
      "explanation": "The Pacific Ocean covers about 63 million square miles."
    }
  ],
  "showScore": true,
  "shuffleQuestions": false
}
